law_act_id,paragraph_id,text
6667999,6668564,"Ichki ishlar organlari tomonidan jinoiy jazoni ijro etish sohasida amalga oshirilayotgan faoliyati samaradorligini yanada oshirish, shuningdek, huquqbuzarliklar profilaktikasi xizmati xodimlarini tanlash va joy-joyiga qo‘yish tizimini takomillashtirish maqsadida: 1. O‘zbekiston Respublikasi Prezidenti va Hukumatining ayrim hujjatlariga 2. Mazkur Farmonning ijrosini nazorat qilish O‘zbekiston Respublikasining Bosh vaziri A.N. Aripov zimmasiga yuklansin. 1. O‘zbekiston Respublikasi Prezidentining 2020-yil 18-fevraldagi “Jamiyatda ijtimoiy-ma’naviy muhitni sog‘lomlashtirish, mahalla institutini yanada qo‘llab-quvvatlash hamda oila va xotin-qizlar bilan ishlash tizimini yangi darajaga olib chiqish chora-tadbirlari to‘g‘risida”gi PF-5938-son Farmonining a)"
6667999,6668577,"“profilaktika inspektorini lavozimga tayinlash va lavozimidan ozod etish, staji va tajribasini inobatga olgan holda mahallaga biriktirish hamda mahalla orasida rotatsiya qilish Qoraqalpog‘iston Respublikasi ichki ishlar vaziri, Toshkent shahar va Toshkent viloyati ichki ishlar bosh boshqarmalari hamda viloyatlar ichki ishlar boshqarmalari boshliqlari tomonidan O‘zbekiston Respublikasi Ichki ishlar vazirligi Jamoat xavfsizligi departamenti Huquqbuzarliklar profilaktikasi xizmati bilan kelishilgan holda amalga oshiriladi (profilaktika inspektori lavozimidan katta profilaktika inspektori lavozimiga o‘tkazish bundan mustasno)”; b) quyidagi mazmundagi yettinchi xatboshi bilan to‘ldirilsin:"
6667999,6668579,"“Qoraqalpog‘iston Respublikasi Ichki ishlar vazirligi, Toshkent shahar va Toshkent viloyati ichki ishlar bosh boshqarmalari va viloyatlar ichki ishlar boshqarmalari Jamoat xavfsizligi xizmatining huquqbuzarliklar profilaktikasi boshqarmalari boshliqlari va ularning o‘rinbosarlari hamda ijtimoiy profilaktika bo‘lim boshliqlari O‘zbekiston Respublikasi Ichki ishlar vazirligi Jamoat xavfsizligi departamentining Huquqbuzarliklar profilaktikasi xizmati bilan kelishilgan holda belgilangan tartibda lavozimga tayinlanadi va lavozimdan ozod etiladi (yuqori turuvchi rahbarlik lavozimiga o‘tkazish holatlari bundan mustasno)”; v) 2. O‘zbekiston Respublikasi Prezidentining 2020-yil 27-oktabrdagi “Davlat ishtirokidagi korxonalarni isloh qilishni jadallashtirish hamda davlat aktivlarini xususiylashtirishga oid chora-tadbirlar to‘g‘risida”gi PF-6096-son Farmoniga 3. O‘zbekiston Respublikasi Prezidentining 2022-yil 17-maydagi “Tibbiyot muassasalari xodimlarini moddiy qo‘llab-quvvatlash hamda rag‘batlantirishni kuchaytirish chora-tadbirlari to‘g‘risida”gi PF-136-son Farmonining"
6667999,6668583,“Mazkur bandda belgilangan qoidalar 2024-yil 1-yanvardan boshlab Ichki ishlar vazirligi tizimidagi tibbiyot va farmatsevtika xodimlariga (maxsus va harbiy unvonga ega bo‘lgan xodim hamda harbiy xizmatchilardan tashqari) nisbatan ham tatbiq etiladi”. 4. O‘zbekiston Respublikasi Prezidentining 2017-yil 29-noyabrdagi PQ-3413-son qarori bilan tasdiqlangan Ichki ishlar organlarida xizmatni o‘tash tartibi to‘g‘risidagi nizomning 19-bandi 5. O‘zbekiston Respublikasi Prezidentining 2019-yil 29-yanvardagi “Ozodlikdan mahrum etilgan shaxslarning mehnat bilan bandligini ta’minlash bo‘yicha qo‘shimcha chora-tadbirlar to‘g‘risida”gi PQ-4138-son qarorining 3-bandida: a) uchinchi va to‘rtinchi xatboshilar quyidagi tahrirda bayon etilsin:
6667999,6668587,"“yetkazib beruvchilar, shu jumladan xorijiy yetkazib beruvchilar bilan ishlab chiqarish va yordamchi uskunalar, texnika va boshqa moddiy-texnik vositalar, resurslar, xomashyo materiallari, o‘simlik urug‘lari, chorva mollarini (shu jumladan yirik va mayda shoxli mollar, parranda, baliq, asalari va boshqalarni) xarid qilish hamda xizmatlar ko‘rsatish bo‘yicha tanlov (tender) savdolarini o‘tkazmasdan to‘g‘ridan-to‘g‘ri shartnomalar tuzish; koloniyalarda ishlab chiqarish faoliyatini kengaytirish, yangi ish o‘rinlarini yaratish hamda mahkumlarning bandligini ta’minlash maqsadida boshqa xo‘jalik yurituvchi subyektlar bilan to‘g‘ridan-to‘g‘ri shartnomalar tuzish orqali hamkorlikni amalga oshirish”; b) yettinchi xatboshi quyidagi tahrirda bayon etilsin:"
6667999,6668590,"“jazoni ijro etish muassasalarining ishlab chiqarish bo‘linmalariga yuqori malakali menejerlarni (mutaxassislarni) Jazoni ijro etish departamentining budjetdan tashqari mablag‘lari hisobidan mehnatga haq to‘lashning eng kam miqdorining 5 baravaridan 15 barobarigacha, zarur mutaxassislikka ega bo‘lmagan xizmat ko‘rsatuvchi xodimlarga mehnatga haq to‘lashning eng kam miqdorining 5 baravarigacha oylik maoshi belgilash hamda ularni jazoni ijro etish muassasalari boshliqlarining ishlab chiqarishni rivojlantirish bo‘yicha o‘rinbosari lavozimiga tayinlash imkoniyati bilan jalb qilish”. 6. O‘zbekiston Respublikasi Prezidentining 2021-yil 2-apreldagi “Ichki ishlar organlarining jamoat xavfsizligini ta’minlash va jinoyatchilikka qarshi kurashish sohasidagi faoliyatini yanada takomillashtirish bo‘yicha qo‘shimcha tashkiliy chora-tadbirlar to‘g‘risida”gi PQ-5050-son a) “jazoni ijro etish muassasalari huzuridagi budjetdan tashqari faoliyatni amalga oshiradigan ishlab chiqarish bo‘linmalari lavozimlariga tegishli sohada amaliy ish tajribasiga ega bo‘lgan shaxslar shahodatlangan lavozimlar hisobidan tayinlanishi mumkin”; b) 9-bandda quyidagi mazmundagi o‘n yettinchi xatboshi bilan to‘ldirilsin: “budjetdan tashqari faoliyat hisobidan ta’minlanadigan ishchi va xizmatchilar shtat soniga o‘zgartirish va qo‘shimchalar kiritish”; o‘n yettinchi 15-bandda quyidagi mazmundagi o‘n to‘qqizinchi va yigirmanchi xatboshilar bilan to‘ldirilsin: “Departament va tizim muassasalarining budjetdan tashqari faoliyatidan ta’minlanadigan ishchi va xizmatchilar shtat birliklarini kiritadi va qisqartiradi; jazoni ijro etish koloniyalari tomonidan tizim tasarrufidagi boshqa bo‘linma yoki jazoni ijro etish koloniyasiga bir yildan ko‘p bo‘lmagan muddatga qaytarib berish sharti bilan moliyaviy yordam ko‘rsatilishini tashkil etadi”; o‘n to‘qqizinchi xatboshi 16-bandning 18-bandning 7. O‘zbekiston Respublikasi Prezidentining 2022-yil 4-apreldagi “Avtomobil yo‘llarida inson xavfsizligini ishonchli ta’minlash va o‘lim holatlarini keskin kamaytirish chora-tadbirlari to‘g‘risida”gi PQ-190-son qarorining o‘n uchinchi xatboshi quyidagi mazmundagi o‘n oltinchi xatboshi bilan to‘ldirilsin:"
6667999,6668614,"“yo‘llar bo‘yida joylashgan maktablar oldida, kamida to‘rt tasmali yo‘llardagi piyodalar o‘tish joylarida hamda yo‘l-transport hodisalar o‘choqlarida belgilangan tezlikni oshirish, piyodalarni o‘tkazmaslik va fuqarolarning yo‘lni belgilanmagan joydan kesib o‘tishi kabi qoidabuzarliklarni aniqlovchi maxsus foto-video qayd etish vositalarini o‘rnatish”. 8. Vazirlar Mahkamasining 2021-yil 15-oktabrdagi “Ichki ishlar organlari faoliyatiga zamonaviy axborot texnologiyalarini keng joriy etish chora-tadbirlari to‘g‘risida”gi 645-son qaroriga"
